{
  "id": "TASK-0001",
  "title": "Create Orchestrator Command Center MVP",
  "status": "DONE",
  "owner": "Technical Agent",
  "dependencies": [],
  "acceptance_criteria": [
    "User can chat with Director",
    "Director can list/read entities from project_data",
    "Director can create DRAFT entity files",
    "User can approve/reject a DRAFT",
    "No automatic CANON promotion",
    "Task board shows BACKLOG/ACTIVE/REVIEW/DONE"
  ],
  "out_of_scope": [
    "Meshy integration",
    "Blender automation",
    "multiplayer networking",
    "video generation"
  ]
}